<?xml version="1.0" encoding="UTF-8" standalone="no" ?>
	<ROOT xmlns:xsi="http://www.w3.org/2001/XMLSchema-instance" xsi:noNamespaceSchemaLocation="TableInfo.xsd">
		<TABLE Name="SubsystemTrackerParametersTable">
			<VIEW Name="SUBSYSTEM_TRACKER_PARAMETERS_TABLE" Type="File,Database,DatabaseTest" Description="No%20description.">
				<COLUMN Type="UID" 	 Name="SubsystemTrackerParametersUID" 	 StorageName="SUBSYSTEM_TRACKER_PARAMETERS_UID" 		DataType="STRING" 		DataChoices=""/>
				<COLUMN Type="Data" 	 Name="NumberParam1" 	 StorageName="NUMBER_PARAM1" 		DataType="NUMBER" 		DataChoices=""/>
				<COLUMN Type="TrueFalse" 	 Name="TrueFalseParam2" 	 StorageName="TRUE_FALSE_PARAM2" 		DataType="STRING" 		DataChoices=""/>
				<COLUMN Type="UniqueData" 	 Name="MustBeUniqueParam3" 	 StorageName="MUST_BE_UNIQUE_PARAM3" 		DataType="STRING" 		DataChoices=""/>
				<COLUMN Type="ChildLink-SubsystemTrackerGroupedParameters" 	 Name="LinkToSubsystemTrackerGroupedParametersTable" 	 StorageName="LINK_TO_SUBSYSTEM_TRACKER_GROUPED_PARAMETERS_TABLE" 		DataType="STRING" 		DataChoices=""/>
				<COLUMN Type="ChildLinkGroupID-SubsystemTrackerGroupedParameters" 	 Name="LinkToSubsystemTrackerGroupedParametersGroupID" 	 StorageName="LINK_TO_SUBSYSTEM_TRACKER_GROUPED_PARAMETERS_GROUP_ID" 		DataType="STRING" 		DataChoices=""/>
				<COLUMN Type="Comment" 	 Name="CommentDescription" 	 StorageName="COMMENT_DESCRIPTION" 		DataType="STRING" 		DataChoices=""/>
				<COLUMN Type="Author" 	 Name="Author" 	 StorageName="AUTHOR" 		DataType="STRING" 		DataChoices=""/>
				<COLUMN Type="Timestamp" 	 Name="RecordInsertionTime" 	 StorageName="RECORD_INSERTION_TIME" 		DataType="TIMESTAMP WITH TIMEZONE" 		DataChoices=""/>
			</VIEW>
		</TABLE>
	</ROOT>
