<?xml version="1.0" encoding="UTF-8" standalone="no" ?>
	<ROOT xmlns:xsi="http://www.w3.org/2001/XMLSchema-instance" xsi:noNamespaceSchemaLocation="TableInfo.xsd">
		<TABLE Name="TriggerConfigTable">
			<VIEW Name="TRIGGER_CONFIG_TABLE" Type="File,Database,DatabaseTest" Description="No%20description.">
				<COLUMN Type="UID" 	 Name="UID" 	 StorageName="UID" 		DataType="STRING" 		DataChoices=""/>
				<COLUMN Type="Data" 	 Name="TriggerDocName" 	 StorageName="TRIGGER_DOC_NAME" 		DataType="STRING" 		DataChoices=""/>
				<COLUMN Type="Data" 	 Name="TriggerConfigTag" 	 StorageName="TRIGGER_CONFIG_TAG" 		DataType="STRING" 		DataChoices=""/>
				<COLUMN Type="Comment" 	 Name="CommentDescription" 	 StorageName="COMMENT_DESCRIPTION" 		DataType="STRING" 		DataChoices=""/>
				<COLUMN Type="Author" 	 Name="Author" 	 StorageName="AUTHOR" 		DataType="STRING" 		DataChoices=""/>
				<COLUMN Type="Timestamp" 	 Name="RecordInsertionTime" 	 StorageName="RECORD_INSERTION_TIME" 		DataType="TIMESTAMP WITH TIMEZONE" 		DataChoices=""/>
			</VIEW>
		</TABLE>
	</ROOT>
