<?xml version="1.0" encoding="UTF-8" standalone="no" ?>
	<ROOT xmlns:xsi="http://www.w3.org/2001/XMLSchema-instance" xsi:noNamespaceSchemaLocation="TableInfo.xsd">
		<TABLE Name="ARTDAQServicesTable">
			<VIEW Name="ARTDAQ_SERVICES_TABLE" Type="File,Database,DatabaseTest" Description="No%20description.">
				<COLUMN Type="UID" 	 Name="servicesUID" 	 StorageName="SERVICES_UID" 		DataType="VARCHAR2" 		DataChoices=""/>
				<COLUMN Type="TrueFalse" 	 Name="sharedMemoryResumeAfterTimeout" 	 StorageName="SHARED_MEMORY_RESUME_AFTER_TIMEOUT" 		DataType="VARCHAR2" 		DataChoices=""/>
        <COLUMN Type="Data" 	 Name="sharedMemoryWaitingTime" 	 StorageName="SHARED_MEMORY_WAITING_TIME" 		DataType="VARCHAR2" 		DataChoices=""/>
        <COLUMN Type="FixedChoiceData" 	 Name="fragmentNamingServiceProvider" 	 StorageName="FRAGMENT_NAMING_SERVICE_PROVIDER" 		DataType="VARCHAR2" 		DataChoices="arbitraryBool=1,OTS,OtsDemo,Mu2e"/>
        <COLUMN Type="ChildLink-daqParameters" 	 Name="ServicesParametersLink" 	 StorageName="SERVICES_PARAMETERS_LINK" 		DataType="VARCHAR2" 		DataChoices="arbitraryBool=0,NO_LINK,ARTDAQDaqParameterTable"/>
				<COLUMN Type="ChildLinkGroupID-daqParameters" 	 Name="ServiceParametersLinkGroupID" 	 StorageName="SERVICE_PARAMETERS_LINK_GROUP_ID" 		DataType="VARCHAR2" 		DataChoices=""/>
				<COLUMN Type="Comment" 	 Name="CommentDescription" 	 StorageName="COMMENT_DESCRIPTION" 		DataType="VARCHAR2" 		DataChoices=""/>
				<COLUMN Type="Author" 	 Name="Author" 	 StorageName="AUTHOR" 		DataType="VARCHAR2" 		DataChoices=""/>
				<COLUMN Type="Timestamp" 	 Name="RecordInsertionTime" 	 StorageName="RECORD_INSERTION_TIME" 		DataType="TIMESTAMP WITH TIMEZONE" 		DataChoices=""/>
			</VIEW>
		</TABLE>
	</ROOT>
