<?xml version="1.0" encoding="UTF-8" standalone="no" ?>
	<ROOT xmlns:xsi="http://www.w3.org/2001/XMLSchema-instance" xsi:noNamespaceSchemaLocation="TableInfo.xsd">
		<TABLE Name="ARTDAQMetricTable">
			<VIEW Name="ARTDAQ_METRIC_TABLE" Type="File,Database,DatabaseTest" Description="No%20description.">
				<COLUMN Type="GroupID-metrics" 	 Name="metricGroupID" 	 StorageName="METRIC_GROUP_ID" 		DataType="VARCHAR2" 		DataChoices=""/>
				<COLUMN Type="UID" 	 Name="metricUID" 	 StorageName="METRIC_UID" 		DataType="VARCHAR2" 		DataChoices=""/>
				<COLUMN Type="OnOff" 	 Name="Status" 	 StorageName="STATUS" 		DataType="VARCHAR2" 		DataChoices=""/>
				<COLUMN Type="Data" 	 Name="metricKey" 	 StorageName="METRIC_KEY" 		DataType="VARCHAR2" 		DataChoices=""/>
				<COLUMN Type="Data" 	 Name="metricPluginType" 	 StorageName="METRIC_PLUGIN_TYPE" 		DataType="VARCHAR2" 		DataChoices=""/>
				<COLUMN Type="Data" 	 Name="metricLevelString" 	 StorageName="METRIC_LEVEL_STRING" 		DataType="VARCHAR2" 		DataChoices=""/>
                <COLUMN Type="TrueFalse" 	 Name="sendSystemMetrics" 	 StorageName="SEND_SYSTEM_METRICS" 		DataType="STRING" 		DataChoices=""/>
                <COLUMN Type="TrueFalse" 	 Name="sendProcessMetrics" 	 StorageName="SEND_PROCESS_METRICS" 		DataType="STRING" 		DataChoices=""/>
				<COLUMN Type="ChildLink-metricParameters" 	 Name="metricParametersLink" 	 StorageName="METRIC_PARAMETERS_LINK" 		DataType="VARCHAR2" 		DataChoices="arbitraryBool=0,NO_LINK,ARTDAQMetricParameterTable"/>
				<COLUMN Type="ChildLinkGroupID-metricParameters" 	 Name="metricParametersLinkGroupID" 	 StorageName="METRIC_PARAMETERS_LINK_GROUP_ID" 		DataType="VARCHAR2" 		DataChoices=""/>
				<COLUMN Type="Comment" 	 Name="CommentDescription" 	 StorageName="COMMENT_DESCRIPTION" 		DataType="VARCHAR2" 		DataChoices=""/>
				<COLUMN Type="Author" 	 Name="Author" 	 StorageName="AUTHOR" 		DataType="VARCHAR2" 		DataChoices=""/>
				<COLUMN Type="Timestamp" 	 Name="RecordInsertionTime" 	 StorageName="RECORD_INSERTION_TIME" 		DataType="TIMESTAMP WITH TIMEZONE" 		DataChoices=""/>
			</VIEW>
		</TABLE>
	</ROOT>
