<?xml version="1.0" encoding="UTF-8" standalone="no" ?>
	<ROOT xmlns:xsi="http://www.w3.org/2001/XMLSchema-instance" xsi:noNamespaceSchemaLocation="TableInfo.xsd">
		<TABLE Name="Mu2eGlobalsTable">
			<VIEW Name="MU2E_GLOBALS_TABLE" Type="File,Database,DatabaseTest" Description="No%20description.">
				<COLUMN Type="UID" 	 Name="UID" 	 StorageName="UID" 		DataType="STRING" 		DataChoices=""/>
				<COLUMN Type="FixedChoiceData" 	 Name="GlobalOperatingMode" 	 StorageName="GLOBAL_OPERATING_MODE" 		DataType="STRING" 		DataChoices="arbitraryBool=0,HardwareDevMode,EventBuildingMode,LoopbackMode"/>
				<COLUMN Type="Data" 	 Name="NumberOfLoopbacks" 	 StorageName="NUMBER_OF_LOOPBACKS" 		DataType="NUMBER" 		DataChoices=""/>
				<COLUMN Type="Data" 	 Name="NumberOfCAPTANPulses" 	 StorageName="NUMBER_OF_CAPTAN_PULSES" 		DataType="NUMBER" 		DataChoices=""/>
				<COLUMN Type="YesNo" 	 Name="SkipCFOandDTCConfigureSteps" 	 StorageName="SKIP_CF_OAND_DTC_CONFIGURE_STEPS" 		DataType="STRING" 		DataChoices=""/>
				<COLUMN Type="Comment" 	 Name="CommentDescription" 	 StorageName="COMMENT_DESCRIPTION" 		DataType="STRING" 		DataChoices=""/>
				<COLUMN Type="Author" 	 Name="Author" 	 StorageName="AUTHOR" 		DataType="STRING" 		DataChoices=""/>
				<COLUMN Type="Timestamp" 	 Name="RecordInsertionTime" 	 StorageName="RECORD_INSERTION_TIME" 		DataType="TIMESTAMP WITH TIMEZONE" 		DataChoices=""/>
			</VIEW>
		</TABLE>
	</ROOT>
