<?xml version="1.0" encoding="UTF-8" standalone="no" ?>
	<ROOT xmlns:xsi="http://www.w3.org/2001/XMLSchema-instance" xsi:noNamespaceSchemaLocation="TableInfo.xsd">
		<TABLE Name="XDAQApplicationTable">
			<VIEW Name="XDAQ_APPLICATION_TABLE" Type="File,Database,DatabaseTest" Description="Each%20record%20in%20this%20table%20represents%20a%20XDAQ%20Application.%20A%20group%20of%20XDAQ%20Applications%20form%20a%20XDAQ%20Context.%20In%20otsdaq%2C%20XDAQ%20Applications%20are%20also%20referred%20to%20as%20%22supervisors%2C%22%20and%20each%20supervisor%20has%20some%20specialized%20role%20with%20names%20such%20as%20%22Gateway%20Supervisor%22%20or%20%22Chat%20Supervisor%22%20or%20%22Macro%20Maker%20Supervisor.%22%0A%0AHere%20are%20some%20notes%20on%20particular%20fields%3A%0A%0A%09-%20%3Cb%3EClass%3A%3C%2Fb%3E%0A%3CINDENT%3EThe%20'Class'%20field%20refers%20to%20a%20valid%20ots%20supervisor%20class.%20Suggested%20classes%20are%20provided%20in%20the%20drop-down%20(e.g.%20%22ots%3A%3AGatewaySupervisor%22)%2C%20however%20arbitrary%20editing%20is%20allowed.%0A%0ANote%20that%20%22ots%3A%3AFESupervisor%2C%22%20%22ots%3A%3ADataManagerSupervisor%2C%22%20and%20%22ots%3A%3AARTDAQDataManagerSupervisor%22%20all%20are%20defined%20in%20the%20same%20library%20so%20the%20'Module'%20path%20for%20these%20classes%20should%20be%20%22%24%7BOTSDAQ_LIB%7D%2FlibCoreSupervisors.so.%22%0A%3C%2FINDENT%3E%0A%09-%20%3Cb%3EId%3A%3C%2Fb%3E%0A%3CINDENT%3EThe%20'Id'%20field%20is%20the%20XDAQ%20Application%20ID.%20It%20must%20be%20unique%20within%20an%20application%20group%20(XDAQ%20Context)%20and%20is%20usually%20a%20value%20between%20200%20and%20999.%3C%2FINDENT%3E%0A%09-%20%3Cb%3EInstance%3A%3C%2Fb%3E%0A%3CINDENT%3EThe%20'Instance'%20field%20is%20the%20XDAQ%20Application%20instance.%20The%20value%20is%20usually%201%2C%20however%20arbitrary%20editing%20is%20allowed.%3C%2FINDENT%3E%0A%09-%20%3Cb%3ENetwork%3A%3C%2Fb%3E%0A%3CINDENT%3EThe%20'Network'%20field%20is%20the%20XDAQ%20Application%20network.%20The%20value%20is%20usually%20%22local%2C%22%20however%20arbitrary%20editing%20is%20allowed.%3C%2FINDENT%3E%0A%09-%20%3Cb%3EGroup%3A%3C%2Fb%3E%0A%3CINDENT%3EThe%20'Group'%20field%20is%20the%20XDAQ%20Application%20group.%20The%20value%20is%20usually%20%22daq%2C%22%20however%20arbitrary%20editing%20is%20allowed.%3C%2FINDENT%3E%0A%09-%20%3Cb%3EModule%3A%3C%2Fb%3E%0A%3CINDENT%3EThe%20'Module'%20field%20refers%20to%20the%20path%20of%20the%20class%20library%20which%20corresponds%20to%20the%20selected%20ots%20supervisor%20class.%20Suggested%20library%20paths%20are%20provided%20in%20the%20drop-down%20(e.g.%20%22%24%7BOTSDAQ_LIB%7D%2FlibGatewaySupervisor.so%22)%2C%20however%20arbitrary%20editing%20is%20allowed.%0A%0ANote%20that%20%22ots%3A%3AFESupervisor%2C%22%20%22ots%3A%3ADataManagerSupervisor%2C%22%20and%20%22ots%3A%3AARTDAQDataManagerSupervisor%22%20all%20are%20defined%20in%20the%20same%20library%20so%20the%20'Module'%20path%20for%20these%20classes%20should%20be%20%22%24%7BOTSDAQ_LIB%7D%2FlibCoreSupervisors.so.%22%0A%3C%2FINDENT%3E%0A%09-%20%3Cb%3EConfigurePriority%3A%3C%2Fb%3E%0A%3CINDENT%3EThe%20'ConfigurePriority'%20field%20sets%20the%20priority%2C%20among%20all%20other%20XDAQ%20Applications%2C%20of%20the%20Application%20when%20the%20%3Ci%3Eotsdaq%3C%2Fi%3E%20state%20machine%20is%20Configured.%20The%20priority%20value%20is%20from%201%20to%20255%20inclusive.%200%20(Default)%20is%20translated%20to%20a%20priority%20of%20100.%20%0A%0AFor%20example%2C%20if%20there%20are%20three%20applications%20A%2C%20B%2C%20C%20with%20priority%201%2C%2099%2C%200%20respectively...%20then%20A%20will%20be%20configured%20first%2C%20followed%20by%20C%2C%20and%20then%20B.%09%0A%3C%2FINDENT%3E%0A%09-%20%3Cb%3EStartPriority%2C%20StopPriority%3A%3C%2Fb%3E%0A%3CINDENT%3EThe%20'StartPriority'%20and%20'StopPriority'%20fields%20are%20the%20similar%20to%20the%20'ConfigurePriority'%20field%20except%20for%20they%20set%20the%20priority%20for%20the%20Start%20and%20Stop%20state%20machine%20transitions.%0A%3C%2FINDENT%3E">
				<COLUMN Type="GroupID-0" 	 Name="ApplicationGroupID" 	 StorageName="APPLICATION_GROUP_ID" 		DataType="STRING" 		DataChoices=""/>
				<COLUMN Type="UID" 	 Name="ApplicationUID" 	 StorageName="APPLICATION_UID" 		DataType="STRING" 		DataChoices=""/>
				<COLUMN Type="ChildLink-0" 	 Name="LinkToSupervisorTable" 	 StorageName="LINK_TO_SUPERVISOR_TABLE" 		DataType="STRING" 		DataChoices="arbitraryBool=0,NO_LINK,GatewaySupervisorTable,FESupervisorTable,FEDataManagerSupervisorTable,DataManagerSupervisorTable,ARTDAQSupervisorTable,ARTDAQOnlineMonitorTable,ARTDAQDataLoggerTable,ARTDAQDispatcherTable,ARTDAQBuilderTable,ECLSupervisorTable,SlowControlsDashboardSupervisorTable"/>
				<COLUMN Type="ChildLinkUID-0" 	 Name="LinkToSupervisorUID" 	 StorageName="LINK_TO_SUPERVISOR_UID" 		DataType="STRING" 		DataChoices=""/>
				<COLUMN Type="OnOff" 	 Name="Status" 	 StorageName="STATUS" 		DataType="STRING" 		DefaultValue="1" 		DataChoices=""/>
				<COLUMN Type="FixedChoiceData" 	 Name="Class" 	 StorageName="CLASS" 		DataType="STRING" 		DataChoices="arbitraryBool=1,ots%3A%3AGatewaySupervisor,ots%3A%3AFESupervisor,ots%3A%3ADataManagerSupervisor,ots%3A%3AFEDataManagerSupervisor,ots%3A%3AARTDAQDataManagerSupervisor,ots%3A%3AARTDAQFEDataManagerSupervisor,ots%3A%3AARTDAQSupervisor,ots%3A%3AARTDAQOnlineMonitorSupervisor,ots%3A%3AEventBuilderApp,ots%3A%3ADispatcherApp,ots%3A%3ADataLoggerApp,ots%3A%3AConfigurationGUISupervisor,ots%3A%3AMacroMakerSupervisor,ots%3A%3AVisualSupervisor,ots%3A%3AChatSupervisor,ots%3A%3AConsoleSupervisor,ots%3A%3ALogbookSupervisor,ots%3A%3ASlowControlsDashboardSupervisor,ots%3A%3ACodeEditorSupervisor,ots%3A%3AECLSupervisor"/>
				<COLUMN Type="UniqueData" 	 Name="Id" 	 StorageName="ID" 		DataType="NUMBER" 		DefaultValue="200" 		DataChoices="" 		MinValue="100" 		MaxValue="999"/>
				<COLUMN Type="Data" 	 Name="Instance" 	 StorageName="INSTANCE" 		DataType="NUMBER" 		DefaultValue="1" 		DataChoices=""/>
				<COLUMN Type="Data" 	 Name="Network" 	 StorageName="NETWORK" 		DataType="STRING" 		DefaultValue="local" 		DataChoices=""/>
				<COLUMN Type="Data" 	 Name="Group" 	 StorageName="GROUP" 		DataType="STRING" 		DefaultValue="daq" 		DataChoices=""/>
				<COLUMN Type="FixedChoiceData" 	 Name="Module" 	 StorageName="MODULE" 		DataType="STRING" 		DataChoices="arbitraryBool=1,%24%7BOTSDAQ_LIB%7D%2FlibGatewaySupervisor.so,%24%7BOTSDAQ_LIB%7D%2FlibCoreSupervisors.so,%24%7BOTSDAQ_LIB%7D%2FlibEventBuilderApp.so,%24%7BOTSDAQ_UTILITIES_LIB%7D%2FlibChat.so,%24%7BOTSDAQ_UTILITIES_LIB%7D%2FlibConsole.so,%24%7BOTSDAQ_UTILITIES_LIB%7D%2FlibLogbook.so,%24%7BOTSDAQ_UTILITIES_LIB%7D%2FlibECLWriter.so,%24%7BOTSDAQ_UTILITIES_LIB%7D%2FlibVisualization.so,%24%7BOTSDAQ_UTILITIES_LIB%7D%2FlibConfigurationGUI.so,%24%7BOTSDAQ_UTILITIES_LIB%7D%2FlibSlowControlsDashboard.so,%24%7BOTSDAQ_UTILITIES_LIB%7D%2FlibMacroMaker.so,%24%7BOTSDAQ_LIB%7D%2FlibARTDAQSupervisor.so,%24%7BOTSDAQ_LIB%7D%2FlibARTDAQOnlineMonitor.so,%24%7BOTSDAQ_LIB%7D%2FlibDispatcherApp.so,%24%7BOTSDAQ_LIB%7D%2FlibDataLoggerApp.so,%24%7BOTSDAQ_LIB%7D%2FlibCodeEditor.so"/>
				<COLUMN Type="Data" 	 Name="ConfigurePriority" 	 StorageName="CONFIGURE_PRIORITY" 		DataType="NUMBER" 		DataChoices=""/>
				<COLUMN Type="Data" 	 Name="StartPriority" 	 StorageName="START_PRIORITY" 		DataType="NUMBER" 		DataChoices=""/>
				<COLUMN Type="Data" 	 Name="StopPriority" 	 StorageName="STOP_PRIORITY" 		DataType="NUMBER" 		DataChoices=""/>
				<COLUMN Type="ChildLink-PropertyGroup" 	 Name="LinkToPropertyTable" 	 StorageName="LINK_TO_PROPERTY_TABLE" 		DataType="STRING" 		DataChoices="arbitraryBool=0,NO_LINK,XDAQApplicationPropertyTable"/>
				<COLUMN Type="ChildLinkGroupID-PropertyGroup" 	 Name="LinkToPropertyGroupID" 	 StorageName="LINK_TO_PROPERTY_GROUP_ID" 		DataType="STRING" 		DataChoices=""/>
				<COLUMN Type="Comment" 	 Name="CommentDescription" 	 StorageName="COMMENT_DESCRIPTION" 		DataType="STRING" 		DataChoices=""/>
				<COLUMN Type="Author" 	 Name="Author" 	 StorageName="AUTHOR" 		DataType="STRING" 		DataChoices=""/>
				<COLUMN Type="Timestamp" 	 Name="RecordInsertionTime" 	 StorageName="RECORD_INSERTION_TIME" 		DataType="TIMESTAMP WITH TIMEZONE" 		DataChoices=""/>
			</VIEW>
		</TABLE>
	</ROOT>
